{
  "metadata": {
    "schema_version": "2.0",
    "generated_at": "2026-04-06T17:53:17.347220+00:00",
    "methodology": "multi-signal-hybrid-v2",
    "source_standard": {
      "name": "AIUC-1",
      "version": "1.0",
      "url": "https://www.aiuc-1.com",
      "controls": 51,
      "domains": 6
    },
    "target_standard": {
      "name": "OWASP Top 10 for Agentic Applications",
      "version": "2026",
      "url": "https://owasp.org/www-project-top-10-for-large-language-model-applications/",
      "entries": 10
    },
    "pipeline": {
      "signals": {
        "reference_bridge": {
          "weight": 0.467,
          "technique": "Jaccard similarity on shared OWASP LLM Top 10 references"
        },
        "semantic": {
          "weight": 0.333,
          "technique": "Sentence-transformer cosine similarity (all-MiniLM-L6-v2) with prevention-guideline boosting and Z-score normalization"
        },
        "keyword": {
          "weight": 0.2,
          "technique": "TF-IDF cosine similarity with domain-specific synonym expansion"
        },
        "function_match": {
          "weight": 0.5,
          "technique": "Multiplicative boost (not additive): content * (1 + boost) when control function class is in threat function profile"
        }
      },
      "thresholds": {
        "direct": 0.55,
        "related": 0.35,
        "governance_floor": 0.22,
        "tangential": 0.2
      }
    },
    "classification": {
      "rationale_taxonomy": {
        "PREV": "Prevent",
        "SCOPE": "Constrain scope",
        "GATE": "Human gate",
        "DETECT": "Detect and trace",
        "VALID": "Validate and test",
        "GOVERN": "Policy and governance",
        "ISOLATE": "Isolate and contain",
        "DISCLOSE": "Disclose and calibrate"
      },
      "relevance_levels": [
        "Primary",
        "Secondary"
      ],
      "classification_accuracy": {
        "training": {
          "standard": "AIUC-1",
          "mappings": 119,
          "rationale_accuracy": 1.0,
          "relevance_accuracy": 0.992
        },
        "validation": {
          "standard": "NIST AI RMF 1.0",
          "mappings": 66,
          "rationale_accuracy": 1.0,
          "relevance_accuracy": 0.848
        }
      }
    }
  },
  "summary": {
    "controls_mapped": "33 / 51",
    "controls_unmapped": 18,
    "owasp_entries_with_matches": 10,
    "total_mappings": 73,
    "primary_mappings": 51,
    "secondary_mappings": 22,
    "rationale_distribution": {
      "SCOPE": 19,
      "ISOLATE": 8,
      "VALID": 12,
      "PREV": 16,
      "GATE": 4,
      "GOVERN": 7,
      "DETECT": 6,
      "DISCLOSE": 1
    }
  },
  "control_level": {
    "source_to_owasp": [
      {
        "control_id": "A001",
        "control_title": "Establish input data policy",
        "domain": "Data & Privacy",
        "function_class": "GOVERN",
        "mapping_count": 0,
        "primary_count": 0,
        "secondary_count": 0,
        "mappings": []
      },
      {
        "control_id": "A002",
        "control_title": "Establish output data policy",
        "domain": "Data & Privacy",
        "function_class": "GOVERN",
        "mapping_count": 0,
        "primary_count": 0,
        "secondary_count": 0,
        "mappings": []
      },
      {
        "control_id": "A003",
        "control_title": "Limit AI agent data collection",
        "domain": "Data & Privacy",
        "function_class": "SCOPE",
        "mapping_count": 3,
        "primary_count": 1,
        "secondary_count": 2,
        "mappings": [
          {
            "owasp_id": "ASI03",
            "owasp_title": "Identity and PrivilegeAbuse",
            "relevance": "Secondary",
            "rationale_code": "SCOPE",
            "rationale_label": "Constrain scope",
            "score": 0.569,
            "signals": {
              "reference_bridge": 0.2,
              "semantic": 0.795,
              "keyword": 0.107
            }
          },
          {
            "owasp_id": "ASI02",
            "owasp_title": "Tool Misuse and Exploitation",
            "relevance": "Primary",
            "rationale_code": "SCOPE",
            "rationale_label": "Constrain scope",
            "score": 0.559,
            "signals": {
              "reference_bridge": 0.333,
              "semantic": 0.612,
              "keyword": 0.065
            }
          },
          {
            "owasp_id": "ASI09",
            "owasp_title": "Human-Agent TrustExploitation",
            "relevance": "Secondary",
            "rationale_code": "SCOPE",
            "rationale_label": "Constrain scope",
            "score": 0.535,
            "signals": {
              "reference_bridge": 0.167,
              "semantic": 0.795,
              "keyword": 0.07
            }
          }
        ]
      },
      {
        "control_id": "A004",
        "control_title": "Protect IP & trade secrets",
        "domain": "Data & Privacy",
        "function_class": "SCOPE",
        "mapping_count": 1,
        "primary_count": 0,
        "secondary_count": 1,
        "mappings": [
          {
            "owasp_id": "ASI04",
            "owasp_title": "Agentic Supply ChainVulnerabilities",
            "relevance": "Secondary",
            "rationale_code": "SCOPE",
            "rationale_label": "Constrain scope",
            "score": 0.609,
            "signals": {
              "reference_bridge": 0.333,
              "semantic": 0.735,
              "keyword": 0.026
            }
          }
        ]
      },
      {
        "control_id": "A005",
        "control_title": "Prevent cross-customer data exposure",
        "domain": "Data & Privacy",
        "function_class": "ISOLATE",
        "mapping_count": 2,
        "primary_count": 2,
        "secondary_count": 0,
        "mappings": [
          {
            "owasp_id": "ASI06",
            "owasp_title": "Memory & Context Poisoning",
            "relevance": "Primary",
            "rationale_code": "ISOLATE",
            "rationale_label": "Isolate and contain",
            "score": 0.605,
            "signals": {
              "reference_bridge": 0.2,
              "semantic": 0.895,
              "keyword": 0.061
            }
          },
          {
            "owasp_id": "ASI03",
            "owasp_title": "Identity and PrivilegeAbuse",
            "relevance": "Primary",
            "rationale_code": "ISOLATE",
            "rationale_label": "Isolate and contain",
            "score": 0.362,
            "signals": {
              "reference_bridge": 0.2,
              "semantic": 0.399,
              "keyword": 0.075
            }
          }
        ]
      },
      {
        "control_id": "A006",
        "control_title": "Prevent PII leakage",
        "domain": "Data & Privacy",
        "function_class": "ISOLATE",
        "mapping_count": 3,
        "primary_count": 3,
        "secondary_count": 0,
        "mappings": [
          {
            "owasp_id": "ASI10",
            "owasp_title": "Rogue Agents",
            "relevance": "Primary",
            "rationale_code": "ISOLATE",
            "rationale_label": "Isolate and contain",
            "score": 0.484,
            "signals": {
              "reference_bridge": 0.167,
              "semantic": 0.708,
              "keyword": 0.046
            }
          },
          {
            "owasp_id": "ASI07",
            "owasp_title": "Insecure Inter-AgentCommunication",
            "relevance": "Primary",
            "rationale_code": "ISOLATE",
            "rationale_label": "Isolate and contain",
            "score": 0.405,
            "signals": {
              "reference_bridge": 0.0,
              "semantic": 0.758,
              "keyword": 0.087
            }
          },
          {
            "owasp_id": "ASI05",
            "owasp_title": "Unexpected CodeExecution (RCE)",
            "relevance": "Primary",
            "rationale_code": "ISOLATE",
            "rationale_label": "Isolate and contain",
            "score": 0.391,
            "signals": {
              "reference_bridge": 0.25,
              "semantic": 0.402,
              "keyword": 0.05
            }
          }
        ]
      },
      {
        "control_id": "A007",
        "control_title": "Prevent IP violations",
        "domain": "Data & Privacy",
        "function_class": "SCOPE",
        "mapping_count": 1,
        "primary_count": 0,
        "secondary_count": 1,
        "mappings": [
          {
            "owasp_id": "ASI04",
            "owasp_title": "Agentic Supply ChainVulnerabilities",
            "relevance": "Secondary",
            "rationale_code": "SCOPE",
            "rationale_label": "Constrain scope",
            "score": 0.664,
            "signals": {
              "reference_bridge": 0.5,
              "semantic": 0.609,
              "keyword": 0.033
            }
          }
        ]
      },
      {
        "control_id": "B001",
        "control_title": "Third-party testing of adversarial robustness",
        "domain": "Security",
        "function_class": "VALID",
        "mapping_count": 4,
        "primary_count": 2,
        "secondary_count": 2,
        "mappings": [
          {
            "owasp_id": "ASI05",
            "owasp_title": "Unexpected CodeExecution (RCE)",
            "relevance": "Secondary",
            "rationale_code": "VALID",
            "rationale_label": "Validate and test",
            "score": 0.769,
            "signals": {
              "reference_bridge": 0.5,
              "semantic": 0.801,
              "keyword": 0.061
            }
          },
          {
            "owasp_id": "ASI06",
            "owasp_title": "Memory & Context Poisoning",
            "relevance": "Primary",
            "rationale_code": "VALID",
            "rationale_label": "Validate and test",
            "score": 0.767,
            "signals": {
              "reference_bridge": 0.75,
              "semantic": 0.45,
              "keyword": 0.054
            }